"","text","id","witness","area","record_row_num"
"1","Rev. JOHN M'NEILL, Minister of the Free Church, Port-na-haven, Islay (39) —examined",720,"Rev John Mcneill","Glasgow, Lanark",1
"2","44726. The Chairman.",720,"Rev John Mcneill","Glasgow, Lanark",2
"3","—Have you got a written statement to make?",720,"Rev John Mcneill","Glasgow, Lanark",3
"4","— Yes. Before I read the written statement, will you allow me to make reference to two letters which I have got here, bearing on the delegates who have come with me from Islay. The delegates are from two different estates. Two are from the estate of Mr Morrison of Islay and three from the estate, of Mrs Baker of Liverpool. I wrote to Mr Morrison's factor about the men from Mr Morrison's estate, and he says",720,"Rev John Mcneill","Glasgow, Lanark",4
"5","—' I can assure you that no action will be taken against the delegates from Port Wemyss on account of any evidence by them before the Commission in Glasgow on the 20th. The other letter is from Mrs Baker, the proprietrix of Cladach and Port-na-haven, to the following effect: ",720,"Rev John Mcneill","Glasgow, Lanark",5
"6","—' I am favoured with your letter this morning. I distinctly refuse to bind myself by any such terms as your ask for. I hope your delegates are not losing their brave spirits, and beginning to show the white feather. They shall have all the credit of their bravery, and shall not give evidence under shelter of any promise of protection from me. Your representatives seem to be chosen from the worst specimens in the village'",720,"Rev John Mcneill","Glasgow, Lanark",6
"7","—they are here before you—but I should not like to put much faith in the Highlanders, as I am afraid they are a little treacherous.'",720,"Rev John Mcneill","Glasgow, Lanark",7
"8","44727. Was this letter intended to be read here by the lady who wrote it?",720,"Rev John Mcneill","Glasgow, Lanark",8
"9","—That is what I meant when I wrote to her. I asked such a promise, and she distinctly refuses,",720,"Rev John Mcneill","Glasgow, Lanark",9
"10","44728. Yes, but you might have stated the fact without reading the letter",720,"Rev John Mcneill","Glasgow, Lanark",10
"11","—I mean not particularly with reference to the assurance, but with reference to the character she gives of the delegates. Do you think the lady, when she wrote the letter, wished and understood that you were to read the letter aloud in so far as the character of the delegates is concerned ? Do you think the lady would like that?",720,"Rev John Mcneill","Glasgow, Lanark",11
"12","—I don't know that.",720,"Rev John Mcneill","Glasgow, Lanark",12
"13","44729. Do you think she intended that letter to be read aloud in a public assembly or not?",720,"Rev John Mcneill","Glasgow, Lanark",13
"14","—Well, she did not desire me not to read it.",720,"Rev John Mcneill","Glasgow, Lanark",14
"15","44730. Perhaps she could not anticipate you would read it. However, it is read now, and I cannot help it. I am bound to say I regret it was read, because I think you could have communicated the fact. The only important thing to us was that this lady refused to give any assurance. I think you might have stated that fact without reading the letter, another portion of which is apt to destroy the confidence or kindly feeling between the lady and her tenants, and which she did not probably expect to be read. You have now a written statement to make ?",720,"Rev John Mcneill","Glasgow, Lanark",15
"16","—Yes. ",720,"Rev John Mcneill","Glasgow, Lanark",16
"17","44731. Will you be so good as to read it?",720,"Rev John Mcneill","Glasgow, Lanark",17
"18","—The area of Islay is about  500 square miles, its extreme length is 30 miles and its breadth is nearly 25 miles.",720,"Rev John Mcneill","Glasgow, Lanark",18
"19","l. Acreage, . . . . 150,000",720,"Rev John Mcneill","Glasgow, Lanark",19
"20","2. Gross rental, . . . .£38,498 13s 9d ; rental in 1872, £30,076.",720,"Rev John Mcneill","Glasgow, Lanark",20
"21","3. Public buildings not assessable, . £302 10s ",720,"Rev John Mcneill","Glasgow, Lanark",21
"22","Subtotal £38,196 3s 9d",720,"Rev John Mcneill","Glasgow, Lanark",22
"23","4. Deduction of 5 per cent. 8&9 Vic. cap. £1,909 16s 2d",720,"Rev John Mcneill","Glasgow, Lanark",23
"24","5. Net amount, . . . .£36,286 7s 7d, or a rental of 4s. 10d. per acre",720,"Rev John Mcneill","Glasgow, Lanark",24
"25","6. Population, . 7500 = 20 acres per inhabitant, inclusive of proprietor and pauper.",720,"Rev John Mcneill","Glasgow, Lanark",25
"26","7. Families, . 1500 = 100 acres to each family.",720,"Rev John Mcneill","Glasgow, Lanark",26
"27","8. Ratepayers, . 750 = 200 acres for each ratepayer; 1300 ratepayers in 1873.",720,"Rev John Mcneill","Glasgow, Lanark",27
"28","The 750 ratepayers comprise the half of the families in the island, and consequently the 150,000 acres must be all nearly in their hands. The other 750 families or non-ratepayers include all whose rent for land is under £ 4 ; these represent generally the landless class, who are wretchedly poor. Further, taking the present agricultural rental of Islay at £36,000, and adopting the ordinary mode of computing rental from produce, say that the half of the farms are dairy farms, yielding an amount equal to three rents ; and the other half pastoral farms yielding two rents, it will be thus found that the whole agricultural produce of the island amounts to £90,000, so that again this sum in the hands of the half of the families in Islay, the favoured landed class. ",720,"Rev John Mcneill","Glasgow, Lanark",28
"29","These statistics clearly prove that Islay is not over-populated, but contrariwise that there is in it enough of land and to spare for a population fully twice as large as its present number. There is therefore no necessity in reason nor in policy for the adoption of a compulsory scheme of emigration with reference to Islay. If there are centres of congested population in the island, they are entirely restricted to badly plauned villages, the receptacles into which have been unwisely compressed the capriciously evicted crofters, the helpless remnants of emigrated families. The cruel process of eviction commenced in Islay in the year 1831, under the so-called mild administration of the Campbells, whose ancestor, Mr Daniel Campbell of Shawfield, bought it one hundred years before that for £6080, sold at £450,000. This silent system of depopulation and consequent deportation was vigorously prosecuted all over Islay during the decennium terminating at census 1841. During the currency of that period a few emigrant vessels left Lochindaal, on board one of these were packed off 402 souls. During this decade from 1831 to 1841, 1300 emigrants sadly departed from the fertile shores of green and grassy Islay. The beautiful glens and the sunny bens were ruthlessly denuded of over 1200 native peasantry during the decennium ending with 1851. The two successive census periods of 1861 and 1871 show the hitherto unprecedented decrease of 4176 in the rural population of Islay. The census of 1881 exhibits a further decrease of 613. Fifty years ago the population of the island was 14,992, now it is only 7526. The family dispersal policy, begun by the Campbells, was bitterly intensified under their trustees, and was consummately perpetuated under the succeeding landlords till within a recent date. The various agents and agencies that co-operated to produce these woeful results might form a patriotic subject of study. The parish of Kilchoman, which includes the parliamentary parish of Port-na-haven, is the finest district in Islay, and presents a pleasing aspect of arableness and agricultural enterprise. Sir Walter Scott, with intuitive appreciation of scenery, refers to the most conspicuous natural characteristic of the island in these words ",720,"Rev John Mcneill","Glasgow, Lanark",29
"30",""" the green Islay's fertile shore "" and "" Islay's verdant coast."" This description holds eminently true of the parish of Kilchoman. Its acreage is 150,000, the most of which is arable land. The population in 1831 was",720,"Rev John Mcneill","Glasgow, Lanark",30
"31","4822 ; in 1881, 2548; decrease 2274. This decrease is mainly attributable to the grouping together of moderately sized holdings into large farms, thus gradually converting extensive tracts of arable land into a waste howling wilderness, and consequently inhumanely depriving the well-to-do tenants of their ancestral possessions, and the contented cottars of labour and of their happy homes. As no schemes of useful steady employment were devised by the landowners to benefit the expelled crofters and the houseless homeless cottars, those of them who could afford it left the parish, and the dispirited surplus was drafted into unhealthy poverty-stricken villages, the Bethesdas of the landless and the afflicted, where with nothing to morally elevate them, but surrounded with much fitted to enervate and depress them, they live a cheerless, hopeless life. The only village industries are whisky distillation, a kind of unsteady work which has a most ruinous influence upon the community. Another prolific source of poverty and misery are the insanitary distillery taps, the village dramshops, to whose pernicious effects the villagers are constantly exposed. I wish the sanitary principles so clearly stated and so ably discussed by Dr Richardson and Dr Carpenter at the sanitary congress recently held in Glasgow could be practically applied to every parish in Islay. In the parish of Kilchoman, exclusive of the parliamentary parish of Port-na-haven, there are only fifty crofters whose  rent is under £20 each. These probably pay from £3 to £6 each. These are generally in straitened circumstances, and their crofts are too highly rented. There are fifty-five tenants whose rent ranges from £20 to £200 each. These are in somewhat comfortable condition. There are three large sheep farms and many smaller ones. Port-na-haven is the designation given both to a village and to a portion of the parish of Kilchoman for parliamentary purposes. The population of this parish is 859. Its extent is about 4200 acres arable land and about 2300 acres pasture ground. There are four large sheep farms, the tenants of two of these are non-resident, and have large farms in the other parishes. They are represented each by a shepherd in the parish of Port-na-haven. About 3000 acres of the ground now under sheep was once arable land. There are four small farmers, whose rents range from £20 to £200. These are fairly well off. The rest is a mixed population of crofters and fishermen. Ten of these crofters have holdings averaging from nine to eighteen acres each. The remainder, the large majority of the population, occupy most inadequately small crofts from half an acre to four acres each of those who have land, but some of them have no land. The rent of these poor patches is too high, and has been increased during the currency of the last forty years in some cases 50 per cent, and in other cases over 100 per cent. While some of the large farmers were allowed abatements of rent, I am not aware that any of the poor crofters have  got any reduction of their rent. This policy with reference to the latter class is one-sided, discouraging, and oppressive. The village of Port-na-haven was formed on exposed, bare, barren rocks in the year 1818 by Captain Walter Campbell of Sunderland, Islay. It contains a population of 361 souls. The original idea was to make it a fishing village, but practically it has been a haven of refuge for the migratory individuals of rural families who had been dispossessed of their homes. They were allowed to erect one-storied dwelling houses, consisting of one room and  kitchen as a rule, on the following co-operative principle —site for house and small plot of ground for garden, annual rent 13s., the tenant to build a house according to proprietor's plan, the tenant to furnish all the building material at his own expense, except the wood and slates, which were furnished by the proprietor at 7½ per cent, per annum during the currency of the lease, a period of ninety-nine years. The tenant at the same time was bound to keep the roof in sufficient repair at his own expense, besides paying 7½ per cent, yearly on the outlay on roof, amounting to sums varying from 19s. and 27s. in the case of each tenant who agreed to build on this principle. It is very significant that when the people of those days were granted a site on this co-operative system a vessel with a cargo of wood was wrecked in the immediate vicinity of this village, and no person was allowed to buy a log of it save the superior, who secured it all, and gave the use of it to the tenants on the above most unreasonable terms. This roof money was so oppressive that some of the poorer tenants fell into arrears, and thereby lost their houses. Others felt it so burdensome that after paying it for thirty, forty, and fifty years they bought the roof. One tenant, who between himself and his father has been paying about 20s. roof money yearly for his house (with liberty to keep it in repairs) for sixty years, is to his great satisfaction to be relieved of this exorbitant tax after this year. The lady who now owns the village being led to  understand how ridiculous and unjust this last case was, granted the craved-for relief to this poor tenant, who in roof money alone paid as much as would purchase twice over his dilapidated domicile. This village lies unhealthily low, exposed to floods afore and aft. ",720,"Rev John Mcneill","Glasgow, Lanark",31
"32","1. Householders without crofts twenty-two; twelve of these have neither croft, boat, cow, nor house of their own. They are all in deep poverty. ",720,"Rev John Mcneill","Glasgow, Lanark",32
"33","2. Householders with most inadequately small crofts fifty-three, in all about seventy-five families. There are about sixty-six and a half of these crofts, each averaging one and a quarter acre, with rents varying per acre from 15s. to 30s. ",720,"Rev John Mcneill","Glasgow, Lanark",33
"34","The number of families who have cows is under twenty, and only a few of these have grazing for their cows on their own small patches of ground ; and as there is no village common, the other fourteen or fifteen cows have to be grazed on another estate, viz., Mr Morrison's. The people who formerly could secure peats on their own lots have now to cut them on a neighbouring farm, each family paying annually for a bad and insufficient supply from 5s. to 10s. The superior gets this money, but the people at their own expense have to keep the peat ground from being flooded with water, because having been in some cases cut twice and thrice it is irregularly hollowed out, and much water lodges on it. The fishing, which has been a comparative failure for some years, cannot be prosecuted under existing conditions for more than four months in the year; and as there are neither public works, agricultural industries, nor any other local remunerative employment, the ill-used, able-bodied fishermen, to keep the wolf from the door, are compelled to seek work outside the island. Some go to sea, others go to centres of trade and commerce, such as Greenock and Glasgow. I know the islands well from the Butt of Lewis to the Rhinns of Islay, and independently of their earnings outside Islay, the villagers of Port-na-haven are the poorest class of fishing crofters ever I saw. Those of them who have neither crofts nor cows are constantly on the verge of starvation. As the landlords take little interest in them, were it not for their proximity to the Clyde shipbuilding yards, where they get work in winter, they would absolutely perish with hunger on a productive wealthy island. A district called Balmeanach, with a goodly number of comfortable and thriving crofters and cottars, was cleared out by Captain Walter Campbell, although none of the crofters were in arrears of rent. This township was added to a neighbouring farm, and the capriciously removed families sought shelter in the neighbouring villages. ",720,"Rev John Mcneill","Glasgow, Lanark",34
"35","Remedies",720,"Rev John Mcneill","Glasgow, Lanark",35
"36","—More land, to all the fishermen who are anxious to have it, and are willing to pay a reasonable rent for it, as they are convinced this would benefit themselves and their families ; or from four to six acres for cropping purposes, and a common grazing ground capable of carrying a cow and follower for each family; Balmeanach added to the village lots would nearly serve this puprose. ",720,"Rev John Mcneill","Glasgow, Lanark",36
"37","Perpetuity of tenure ; they are at present tenants at will. ",720,"Rev John Mcneill","Glasgow, Lanark",37
"38","Reduction of present rents in cases where they are too high; this done by arbitration ; title-deeds to house property. ",720,"Rev John Mcneill","Glasgow, Lanark",38
"39","Peat ground paid for according to the perches of it cut and kept drained by superior. ",720,"Rev John Mcneill","Glasgow, Lanark",39
"40","The village of Port Wemyss, projected by Mr W. F. Campbell of Islay early in this century, has a population of 263 souls, or about fifty families. The houses were erected by the tenants at their own expense, slate roofed, and mostly consist of one room and kitchen, with plot of ground for garden. Annual rent for site of dwellinghouse and garden, 15s. With very few exceptions, the tenants possess neither building leases nor title-deeds for their house property. They are fishermen. Thirty-eight have crofts, average two acres each; rents, lowest 7s. 6d., highest 27s. per acre. There are twelve fishermen without lots. These are poorer than those who have a small piece of ground. Peats were free at first, because secured on village crofts which originally consisted mainly of peat moss. Now each family pays 5s. yearly for peat ground on a neighbouring farm. They do not grudge to pay this sum, on condition a proper road is made to the peat moss. When the ",720,"Rev John Mcneill","Glasgow, Lanark",40
"41","season is wet the want of a proper road to this ground is felt to be a great drawback. About the half of the fifty families have no cows. The fisherman without lot or cow is very poor. There is a village common, designated characteristically Cladach dubh, mostly the bottom of used-up peat ground, a coarse, barren space, where the cows have to be hand-fed duriug the summer season, or else they give no milk. This park is even a help, as it keeps the cattle together while the lots are under crops. To have a cow and follower in Cladach dubh costs 28s. yearly. If all the families had each a cow and follower there during summer, if not otherwise fed, they would absolutely starve. There is a class of crofters who about thirty-two years ago got money advanced them for draining purposes at about £6 per cent, per annum, on condition that at the termination of twenty-one years the interest should cease; but as it is now part and parcel of the rent, the crofters are still forced to pay it. There is another class of tenants who never received a farthing for reclaiming, draining, or improving their crofts, but who, with much persevering labour and personal inconvenience to themselves and to their families, and entirely at their own expense, converted boggy peat ground into arable land, yet these and others forty years ago, to their great discouragement, had their rents raised by Mr William Webster, factor. In some cases this increase of rent was 50 per cent., in other cases over 100 per cent. This rise of rent when clapped on was not known to the crofters for two years, and then it had to be paid as arrears in addition to the original rent. These high rents they still pay. But the most of these grievances are of long standing, for the crofters have been subjected to these excessive exactions before the present proprietor bought the estate. When Mr Charles Morrison of London purchased the Islay estate a large number of the crofters were deeply in arrears, but to their credit let it be stated that with very few exceptions they have paid them up. When the late proprietor, Mr Campbell, planned the village of Port Wemyss, he personally pointed out to the people all the land that was to be attached thereto. On the strength of this promise, families secured sites for dwelling houses and settled in the village. This promise as yet remains unfulfilled. Only 104 acres of Cladach dubh out of the large stretch of land promised them were ever given them. ",720,"Rev John Mcneill","Glasgow, Lanark",41
"42","Remedies suggested",720,"Rev John Mcneill","Glasgow, Lanark",42
"43","—Reduction of rent to a judicially fair amount in each case, average value of each acre from 7s. 6d. to 12s. 6d. The ground is but soft, porous  and generally underlaid, and dotted with rocks. It by continuous cropping yields but a most scanty return to its tillers. The whole of Cladach dubh, in proportion to what the large farmers pay for the same kind of land, is to the, villagers worth about £5 yearly ; larger holdings at least to the extent of the original promise, or from six to thirty acres to each crofter as he is willing and able to pay for it. The discontinuance henceforth of the interest on the drainage money; perpetuity of tenure ; title-deeds for house property; the formation of a road to the peat ground; and the abolition of the system of  competition, compelling the occupying tenant to bid on his own industry. The Port Wemyss crofters are hopeful that their landlord, whose management of the village has been on the whole humane and considerate, will take the earliest opportunity of redressing their grievances. The erection of a pier between the villages of Port Wemyss and Port-na-haven, and the construction of local harbour accommodation for the fishing boats, would tend to develop the fishing resources of the district and to create trade. The scheme to build a pier is in my opinion quite practicable. The old "" Pharos,"" of the Northern Lighthouse Commissioners, periodically for",720,"Rev John Mcneill","Glasgow, Lanark",43
"44","eight years called at the very point where it is proposed the pier should be erected. Depth at low water, fourteen feet; distance from two opposite islands which are like a natural breakwater to protect it, about 800 feet ; distance from the current of the sound intervening between the villages and the lighthouse, one hundred feet. From either village a horse and cart can almost get to the water edge of this contemplated pier rock. It",720,"Rev John Mcneill","Glasgow, Lanark",44
"45","would command the whole trade of the parish of Port-na-haven, as the nearest pier is from six to nine miles from the most of the parishioners. The poor fishermen are compelled to haul ashore their luggers in winter.",720,"Rev John Mcneill","Glasgow, Lanark",45
"46","A proper harbour would be an immense boon to them, as they could have their boats sheltered and ready for use if required during winter.",720,"Rev John Mcneill","Glasgow, Lanark",46
"47","Cladach. ",720,"Rev John Mcneill","Glasgow, Lanark",47
"48","Complaints",720,"Rev John Mcneill","Glasgow, Lanark",48
"49","—The population is sixty-six, tenants ten, six have eighteen acres each, and four have nine acres each; rent £12 for each eighteen acres, irrespective of the quality of the soil, whether good, bad, or indifferent. About fifty-six years ago Captain Walter Campbell, the proprietor, deprived the tenants of the use of a common grazing park capable of grazing eight horses, and for this deprivation no abatement of rent was allowed. The original rents ranged from £7 to £10 for each croft of eighteen acres. During the last twenty-five years the rents have been raised twice; the last additional increase was made two years ago, varying from £1, 10s. to £ 2 per eighteen acres, so as to have a uniform rent of £12 each. The Cladach crops are often damaged by the northern and western blasts from the Atlantic Ocean; and as the soil is but soft and porous, it invariably yields but a scanty return to its most skilled cultivators. All these crofters are tenants at will, and receive neither inducements nor encouragements to reclaim or improve the land.",720,"Rev John Mcneill","Glasgow, Lanark",49
"50","Remedies",720,"Rev John Mcneill","Glasgow, Lanark",50
"51","—Reduction of rent to a judicially fair amount in each case; perpetual leases, or reasonable security of tenure; larger holdings; compensation for improvements effected by the tenants themselves.'",720,"Rev John Mcneill","Glasgow, Lanark",51
"52","44732. Professor Mackinnon.",720,"Rev John Mcneill","Glasgow, Lanark",52
"53","—The particular portion of Islay from which the delegates are here to-day, along with yourself, is the portion over which you have charge as Free Church minister ?",720,"Rev John Mcneill","Glasgow, Lanark",53
"54","—Yes.",720,"Rev John Mcneill","Glasgow, Lanark",54
"55","44733. And it comprises two estates ?",720,"Rev John Mcneill","Glasgow, Lanark",55
"56","—Yes.",720,"Rev John Mcneill","Glasgow, Lanark",56
"57","44734. One small one and one very large one ?",720,"Rev John Mcneill","Glasgow, Lanark",57
"58","—Yes.",720,"Rev John Mcneill","Glasgow, Lanark",58
"59","44735. Are they all at the fishing—all those who have sent delegates here ?",720,"Rev John Mcneill","Glasgow, Lanark",59
"60","—Yes, except the district of Cladach.",720,"Rev John Mcneill","Glasgow, Lanark",60
"61","44736. That is a crofting district t",720,"Rev John Mcneill","Glasgow, Lanark",61
"62","—Yes. ",720,"Rev John Mcneill","Glasgow, Lanark",62
"63","44737. And we will hear themselves upon that subject?",720,"Rev John Mcneill","Glasgow, Lanark",63
"64","—Yes; there is a representative here from that district.",720,"Rev John Mcneill","Glasgow, Lanark",64
